{
  "$schema": "https://json-schema.org/draft/2020-12/schema",
  "title": "Phase 12 Nagoya official source inventory",
  "type": "object",
  "additionalProperties": false,
  "required": ["id","phase","status","official_code","name_ja","prefecture_name_ja","review_status","plan_period","sources","quality_boundary","next_action","verified_at"],
  "properties": {
    "id": {"const": "phase12-nagoya-source-inventory"},
    "phase": {"const": 12},
    "status": {"const": "source_inventory_complete"},
    "official_code": {"const": "231002"},
    "name_ja": {"const": "名古屋市"},
    "prefecture_name_ja": {"const": "愛知県"},
    "review_status": {"const": "indexed_not_reviewed"},
    "plan_period": {
      "type": "object",
      "additionalProperties": false,
      "required": ["start_fiscal_year","end_fiscal_year","current_plan_name"],
      "properties": {
        "start_fiscal_year": {"const": 2024},
        "end_fiscal_year": {"const": 2028},
        "current_plan_name": {"const": "名古屋市総合計画2028"}
      }
    },
    "sources": {
      "type": "array",
      "minItems": 5,
      "maxItems": 5,
      "uniqueItems": true,
      "items": {
        "type": "object",
        "additionalProperties": false,
        "required": ["id","layer","title","official_url","status","review_boundary"],
        "properties": {
          "id": {"type": "string", "minLength": 5},
          "layer": {"enum": ["comprehensive_plan","implementation_plan","annual_progress","budget","settlement"]},
          "title": {"type": "string", "minLength": 3},
          "official_url": {"type": "string", "format": "uri", "pattern": "^https://www\\.city\\.nagoya\\.jp/"},
          "status": {"const": "official_landing_verified"},
          "review_boundary": {"type": "string", "minLength": 60},
          "effective_period": {"type": "string"},
          "fiscal_year": {"type": "integer"}
        }
      }
    },
    "quality_boundary": {"type": "string", "minLength": 160},
    "next_action": {"type": "string", "minLength": 140},
    "verified_at": {"const": "2026-08-07", "format": "date"}
  }
}
